{
  "artifacts": [
    {
      "kind": "access_point",
      "path": ".github/workflows/p13-ruler.yml",
      "sha256": "9ebef866599e8a38187ffdf6677e7c33540a3c7259a1ce2fead9a0598deddb62",
      "size_bytes": 17113
    },
    {
      "kind": "access_point",
      "path": "Makefile",
      "sha256": "12f50fa003b9c4dfab16e826c475299c4542db6e2fd6bec555202a9fe7c83244",
      "size_bytes": 888
    },
    {
      "kind": "access_point",
      "path": "calendar-pilot-p12/Makefile",
      "sha256": "c4e263ce9c187a94fe8ea1d4ed91e9504bb5dcedd5a207306c788eef7dda60b8",
      "size_bytes": 10591
    },
    {
      "kind": "access_point",
      "path": "calendar-pilot-p12/README.md",
      "sha256": "c00a08a775269a75e40d1c971d2ffff21c4bd0e7ff6052425626bfa17588667f",
      "size_bytes": 18569
    },
    {
      "kind": "architecture",
      "path": "compression-roadmap.md",
      "sha256": "e0769d8aa2a471e6cd196276fa4d5b709ed5e4c69360f8e7b46fa982af114f15",
      "size_bytes": 137201
    },
    {
      "kind": "configuration",
      "path": "calendar-pilot-p12/configs/p13_instrument_artifacts.json",
      "sha256": "25ed8aeb36b272a1bc08aac3b3a81713379ebb158967a413a24efdbb841745d1",
      "size_bytes": 10843
    },
    {
      "kind": "configuration",
      "path": "calendar-pilot-p12/configs/p13_learning_optimizer_boundary.json",
      "sha256": "a8cd9e7d410971b5c7b97ae6b218ad125f09651bc8fe009ac5b55e2794b640ac",
      "size_bytes": 572
    },
    {
      "kind": "configuration",
      "path": "calendar-pilot-p12/configs/p13_learning_promotion_public.pem",
      "sha256": "22b5b6479ae70799f101caecef35a51db9e3c7c52ac317b925edc7de532ac9a2",
      "size_bytes": 451
    },
    {
      "kind": "configuration",
      "path": "calendar-pilot-p12/configs/p13_learning_promotion_root.json",
      "sha256": "0c9835257a6d04ea01e3c2e93455c70fa8b6dea0277b6df3073a1c2e13452750",
      "size_bytes": 323
    },
    {
      "kind": "configuration",
      "path": "calendar-pilot-p12/configs/p13_ownership_map.json",
      "sha256": "c298e788068a6134b2b3ebd7b3f3af9628f97dd5225db56f5fb1adbb782f7b97",
      "size_bytes": 5749
    },
    {
      "kind": "configuration",
      "path": "calendar-pilot-p12/configs/training_weights.json",
      "sha256": "14ec557019dc0e9b87871c4ae72619789e1fe165f27483b4abd8f74a134fda39",
      "size_bytes": 181
    },
    {
      "kind": "configuration",
      "path": "calendar-pilot-p12/experiments/configs/b_migrate_create_prep_block_p13_1.json",
      "sha256": "be71d365f9c777a607f7b432b5eea2c9f7a624269c1b2f8136e2e15e78e72c44",
      "size_bytes": 2561
    },
    {
      "kind": "configuration",
      "path": "calendar-pilot-p12/experiments/configs/b_migrate_create_prep_block_p13_3.json",
      "sha256": "b8275fc425609a359508924b570e645c467ef5215060e79231584b5371309636",
      "size_bytes": 2191
    },
    {
      "kind": "configuration",
      "path": "calendar-pilot-p12/experiments/configs/b_migrate_create_prep_block_read_side_p13_2.json",
      "sha256": "f68215c3ecf1eebaaabff43426b56066dca0ba3504aecc273db058c1e96c1d10",
      "size_bytes": 1026
    },
    {
      "kind": "configuration",
      "path": "calendar-pilot-p12/experiments/configs/b_migrate_frontend_view_state.json",
      "sha256": "5b2d0653d7339a55d8159eea5110c862c1eec48a667de964f098a07daa8a9540",
      "size_bytes": 1198
    },
    {
      "kind": "configuration",
      "path": "calendar-pilot-p12/experiments/configs/b_migrate_frontend_view_state_v2.json",
      "sha256": "da6095342b20d85b331ebcd9c3e34e070b6fc74a34fce3f2ab11cbd72e664ba0",
      "size_bytes": 1322
    },
    {
      "kind": "configuration",
      "path": "calendar-pilot-p12/experiments/configs/create_prep_block_required_fields_v1.json",
      "sha256": "cb5cf66adc01d61a1fe2ac937e2bd2d1209fb890ecf97cafc3648aa5c8b73f9f",
      "size_bytes": 1648
    },
    {
      "kind": "configuration",
      "path": "calendar-pilot-p12/experiments/configs/cvar_seed_set.json",
      "sha256": "6341f5ea14ea75de57c32cf6ca50feeac55890f0a7fd88239306eba1befcafaf",
      "size_bytes": 558
    },
    {
      "kind": "configuration",
      "path": "calendar-pilot-p12/experiments/configs/cvar_thresholds.json",
      "sha256": "79578d4ba54953df0b5d0f326258756103cad06244d145d8ff8b13452ef4fb12",
      "size_bytes": 256
    },
    {
      "kind": "configuration",
      "path": "calendar-pilot-p12/experiments/configs/promotion_thresholds.json",
      "sha256": "8d2362be24f1c2d7365d00c26ac244999506e0d37e5e2c67b1621fbd17a50459",
      "size_bytes": 530
    },
    {
      "kind": "contract",
      "path": "calendar-pilot-p12/contracts/VERSIONS.json",
      "sha256": "82fe792e983282a1270485e6967fff3f5f4f02bfff3fcf42163d04cf1aebe7ce",
      "size_bytes": 2451
    },
    {
      "kind": "contract",
      "path": "calendar-pilot-p12/contracts/architecture_eval_report.schema.json",
      "sha256": "0a1a9bd95241103880ef2cdf9ef3cd83d6e40896890c784e5b1ad74906bcf991",
      "size_bytes": 8961
    },
    {
      "kind": "contract",
      "path": "calendar-pilot-p12/contracts/architecture_eval_report_v2.schema.json",
      "sha256": "866ce3a5c4f39f606f77575b76aef2778902febb77f995082319e4e1734faec4",
      "size_bytes": 3649
    },
    {
      "kind": "contract",
      "path": "calendar-pilot-p12/contracts/b_migrate_artifact.schema.json",
      "sha256": "49589df82d7735adac4d44cad56a8d5975cfac0cfe7e0f9c5cab9d12682d351f",
      "size_bytes": 1143
    },
    {
      "kind": "contract",
      "path": "calendar-pilot-p12/contracts/b_migrate_report.schema.json",
      "sha256": "9a1d7935e4df8f32461aeccc1bd393dd753ab1e54f146b3fdb5ad684ce0d0096",
      "size_bytes": 898
    },
    {
      "kind": "contract",
      "path": "calendar-pilot-p12/contracts/b_migrate_report_v2.schema.json",
      "sha256": "599ee9cfdbb01ce8bc5f8babeb4be877b70ee061a0924b334d11a1fe9ee7bc1f",
      "size_bytes": 1046
    },
    {
      "kind": "contract",
      "path": "calendar-pilot-p12/contracts/cvar_frontier_set.schema.json",
      "sha256": "de89081eab3bc3e9c357f211eaba615e4af5e4ab412d4b6edaa95c6e42cf01ec",
      "size_bytes": 1170
    },
    {
      "kind": "contract",
      "path": "calendar-pilot-p12/contracts/cvar_report.schema.json",
      "sha256": "313b8cccf09de0e753d479a0de8a8c2c96dbc76f70973eb0565e339f9f1304b8",
      "size_bytes": 1284
    },
    {
      "kind": "contract",
      "path": "calendar-pilot-p12/contracts/cvar_report_v2.schema.json",
      "sha256": "da0cc8b69ba8d0ff15bb4b01d33d078afb2d27253e8dc82ebaa29f2a21863821",
      "size_bytes": 1164
    },
    {
      "kind": "contract",
      "path": "calendar-pilot-p12/contracts/experiment_record.schema.json",
      "sha256": "4f200d13820ca7da7f2006fd85d7c3fe3543ee0e285dbddbbd13f832da5c4cd2",
      "size_bytes": 898
    },
    {
      "kind": "contract",
      "path": "calendar-pilot-p12/contracts/experiment_record_v2.schema.json",
      "sha256": "b938d8691895c187c846cc8d8565458f7b24c8835fcc612a5804ce458b39a929",
      "size_bytes": 3674
    },
    {
      "kind": "contract",
      "path": "calendar-pilot-p12/contracts/learning_partition_manifest.schema.json",
      "sha256": "060767bf5f815c14e8c1fbe9d33eb661c2db83bac149e391d5867322b4633d2b",
      "size_bytes": 2482
    },
    {
      "kind": "contract",
      "path": "calendar-pilot-p12/contracts/managed_eventkit_live_certificate.schema.json",
      "sha256": "87e5254a4dd2a14e5278ef180c659bf85b8a6e1c5b9f34cce51ebaf8721bbb3b",
      "size_bytes": 3663
    },
    {
      "kind": "contract",
      "path": "calendar-pilot-p12/contracts/optimizer_execution_report.schema.json",
      "sha256": "51a97f420fdecd3019243007e786aa49d0344ae072308f0a6edaf5f48d2ee97b",
      "size_bytes": 1865
    },
    {
      "kind": "contract",
      "path": "calendar-pilot-p12/contracts/p13_attestation_scaffold_report.schema.json",
      "sha256": "18de98c0881bcea30c0b1f1fa2189d1c82827074becc82551c9982d2adc11451",
      "size_bytes": 2388
    },
    {
      "kind": "contract",
      "path": "calendar-pilot-p12/contracts/p13_binding_manifest.schema.json",
      "sha256": "b3b36d33cc50e1a8a183a37cf0a5ceffb4fac09802c1c959323ffbfc0d0611e2",
      "size_bytes": 2414
    },
    {
      "kind": "contract",
      "path": "calendar-pilot-p12/contracts/p13_binding_manifest_verification.schema.json",
      "sha256": "aacd902ecf56f6d2829b216545b2cb9a713bd24745b12cf3686d1cee7558bde4",
      "size_bytes": 825
    },
    {
      "kind": "contract",
      "path": "calendar-pilot-p12/contracts/p13_evaluation_packet_scaffold.schema.json",
      "sha256": "58ed8a6f0d59e77c79b70244f0c91786a015ab67e75528b7c7d82dbd0feda1be",
      "size_bytes": 5931
    },
    {
      "kind": "contract",
      "path": "calendar-pilot-p12/contracts/p13_instrument_bundle.schema.json",
      "sha256": "784bac1b9efb220561b38425f39b2405b253baf3c53e1f42ab060c000646fdef",
      "size_bytes": 1475
    },
    {
      "kind": "contract",
      "path": "calendar-pilot-p12/contracts/p13_loc_report.schema.json",
      "sha256": "70e7d3a73d12b723878c2a8d958a3af351e68e5314d7c69fbbb9216893fe303a",
      "size_bytes": 1532
    },
    {
      "kind": "contract",
      "path": "calendar-pilot-p12/contracts/p13_root_list_verification.schema.json",
      "sha256": "dff90e55c36082626ba54fb981502aaf0f7c86a84174233508b4539c4cf3b4e5",
      "size_bytes": 781
    },
    {
      "kind": "contract",
      "path": "calendar-pilot-p12/contracts/p13_scaffolding_trust_policy.schema.json",
      "sha256": "c3b9a1cdd507b16e2d4ae5e481667a1929f66375c6b436ffbfa13b3b5b154fcd",
      "size_bytes": 2453
    },
    {
      "kind": "contract",
      "path": "calendar-pilot-p12/contracts/p13_tcb_review_attestation_scaffold.schema.json",
      "sha256": "c6689fe6af56b379623e0e9d23b0c20f9b02a38d916584640be021a4a8c60d69",
      "size_bytes": 2562
    },
    {
      "kind": "contract",
      "path": "calendar-pilot-p12/contracts/p13_wave_gate_report.schema.json",
      "sha256": "798a25f634a1d7995eb749848d4660b99d4eb98880331862643b5b1e3711d9e1",